id,name,email,bio,skills,score,reason
1,John Doe,johndoe@example.com,"John is a passionate junior developer with a strong background in front-end technologies. He recently completed a web development bootcamp, where he built multiple responsive websites using React, CSS, and HTML. John is eager to apply his skills in a real-world setting and grow as a developer. He is highly detail-oriented and a fast learner.","React, CSS, HTML, Git",72,"John Doe demonstrates a strong foundational skill set relevant to the Junior React Developer position, particularly with front-end technologies such as React, CSS, and HTML which aligns well with the job requirements. His completion of a web development bootcamp indicates a recent and focused learning experience, and his eagerness and fast learning ability show good growth potential. However, the candidate lacks explicit mention of experience with Next.js, TypeScript, Git, RESTful APIs, and the Vercel AI SDK, which are important for this role. Additionally, while he is detail-oriented and motivated, there is no direct evidence of teamwork or collaboration skills critical for working alongside senior developers. Overall, John is a promising candidate with a solid base and the right attitude to grow into the role with proper mentorship, but currently falls short on some technical specifics and demonstrated professional experience."
2,Sarah Lee,sarahlee@example.com,"Sarah is a self-taught developer who has been building personal projects for the past year. Her portfolio includes a fully responsive personal blog and a task manager app, both built using React and Next.js. She enjoys the challenge of problem-solving and is constantly expanding her skill set through online courses. Sarah thrives in collaborative environments and is excited to contribute to team projects.","React, Next.js, JavaScript, CSS, HTML",72,"Sarah demonstrates foundational skills relevant to the Junior React Developer role, notably building projects using React and Next.js, which aligns well with the technical requirements. Although she is self-taught with about a year of experience, her practical experience includes fully responsive applications, indicating a solid grasp of front-end development essentials. Her proactive approach to learning through online courses and enthusiasm for problem-solving show strong growth potential. Additionally, her preference for collaborative environments and excitement for team contributions suggest a good cultural fit with the supportive and mentorship-driven company culture. However, Sarah lacks direct experience with some key qualifications such as TypeScript, CSS, HTML, Git, RESTful APIs, and familiarity with the Vercel AI SDK, which are important for this role. She also has less than the preferred 1-2 years of experience, which affects her readiness to contribute independently at the expected level. Overall, Sarah is a promising candidate with clear motivation and foundational skills, suitable for the role with some initial guidance and training."
3,Michael Young,michaelyoung@example.com,"Michael recently graduated from a coding bootcamp and is skilled in web development, particularly in React-based applications. During his bootcamp, he worked on a capstone project where he developed a social media dashboard using React, JavaScript, and Git for version control. Michael is passionate about technology and is looking for an opportunity to apply his skills in a dynamic team environment.","React, JavaScript, CSS, Git",68,"Michael Young is a recent coding bootcamp graduate with practical skills in React, JavaScript, and Git, demonstrated through a capstone project building a social media dashboard. While he clearly shows enthusiasm and foundational ability for front-end web development, he lacks the 1-2 years of professional experience specifically with React and Next.js required for the role. Additionally, there is no mention of experience with TypeScript, CSS, HTML, RESTful APIs, or familiarity with Vercel AI SDK, which are important for this position. However, Michael's passion for technology and desire to grow within a dynamic team environment indicate strong growth potential and good cultural fit for a junior developer who can benefit from mentorship and collaborative learning. Overall, Michael is a promising early-career candidate but would need to build more hands-on experience with the full tech stack and AI integration to fully meet the job requirements."
4,Linda Smith,lindasmith@example.com,"Linda is an experienced full-stack developer with a focus on front-end technologies. She has over three years of experience working with React and Next.js. Recently, she has been exploring AI integrations, using the Vercel AI SDK and CrewAI to enhance user experiences in web applications. Linda excels at creating seamless, user-friendly interfaces and optimizing performance.","React, Next.js, JavaScript, Vercel AI SDK, CrewAI, REST APIs",88,"Linda Smith has a very strong match for the Junior React Developer role. She brings over three years of experience working with React and Next.js, which exceeds the required 1-2 years, demonstrating a solid foundation in front-end development. Her recent work with AI integrations using the Vercel AI SDK and CrewAI directly aligns with the job’s focus on enhancing user experiences with AI-driven features, a distinctive asset. She excels at creating user-friendly interfaces and optimizing performance, matching key responsibilities like component development, application optimization, and responsiveness. While the bio does not explicitly mention experience with Git, RESTful APIs, TypeScript, or teamwork skills, her ongoing engagement in relevant projects suggests she likely possesses or can quickly develop these skills. Culturally, her commitment to seamless user experiences and exploration of new technologies indicates a growth mindset and initiative, which aligns well with the collaborative and mentorship-supported environment offered. Overall, Linda’s experience, technical fit, and evident potential for growth make her a strong candidate for this junior-level position, meriting a high score though not perfect due to slight gaps in explicit detail on broader qualification criteria."
5,Tom Brown,tombrown@example.com,"Tom is a mid-level developer with hands-on experience working on commercial projects using React and Next.js. He has built several customer-facing websites and eCommerce platforms, focusing on performance optimization and SEO. He is proficient in REST APIs and enjoys building scalable web solutions that improve user engagement.","React, Next.js, CSS, HTML, Git, REST APIs",78,"Tom Brown has relevant experience as a mid-level developer with hands-on work in React and Next.js on commercial projects, notably building customer-facing websites and eCommerce platforms focused on performance and SEO. This aligns well with the Junior React Developer role requirements for React and Next.js experience, performance optimization, and API integration. He is proficient with REST APIs, matching the job's expectations. However, the bio does not mention experience with TypeScript, CSS, HTML explicitly, nor familiarity with the Vercel AI SDK or AI integrations, which are desirable for the role. Tom’s mid-level status suggests he may seek growth opportunities, and his enjoyment of scalable solutions and user engagement indicates a good cultural fit, motivated by quality and user experience. The job offers mentorship and growth potential which suits his profile well. Overall, Tom is a strong candidate for this junior role, with minor gaps in specific technologies and AI experience that could be addressed through the company’s mentorship and learning environment."
6,Kate Adams,kateadams@example.com,Kate is an AI enthusiast with a solid background in front-end development and experience using the Vercel AI SDK and CrewAI. She has contributed to projects that leverage AI to improve user interaction and personalization. Kate is passionate about staying at the cutting edge of technology and is excited to work on projects that push the boundaries of what's possible.,"React, Next.js, Vercel AI SDK, CrewAI, JavaScript, Git",82,"Kate Adams demonstrates a strong alignment with the Junior React Developer role through her solid background in front-end development, which likely includes React and Next.js skills given the context, as well as direct experience with the Vercel AI SDK and CrewAI. This is a significant advantage since the role prioritizes integration of AI-driven features using the Vercel AI SDK. Her passion for cutting-edge technology and AI suggests a cultural fit that values innovation and continuous learning, which matches well with the company's supportive environment and mentorship emphasis. While her bio does not explicitly detail proficiency in JavaScript, TypeScript, CSS, HTML, Git, or RESTful APIs, the indication of front-end experience implies familiarity with these essentials. Her enthusiasm and prior contributions to AI-enhanced user interactions reflect growth potential and alignment with the job’s focus on AI-powered web applications. The only reservation is the lack of explicit mention of the full listed technical stack and the 1-2 years experience benchmark, which prevents a perfect score. Overall, Kate is a promising candidate with the skills, enthusiasm, and mindset to contribute effectively and grow in this role."
7,Robert Johnson,robertjohnson@example.com,"Robert is a highly skilled front-end developer with a deep knowledge of React and AI-powered applications. He has worked on multiple projects that integrate AI to provide enhanced user experiences, including a recommendation engine built using the Vercel AI SDK. Robert is known for his attention to detail and ability to produce high-quality, maintainable code.","React, Next.js, JavaScript, Vercel AI SDK, CrewAI, CSS, Git, REST APIs",82,"Robert Johnson demonstrates a strong skill match with the Junior React Developer role. He has deep knowledge of React and experience working with AI-powered applications, including a recommendation engine using the Vercel AI SDK, which is perfectly aligned with the job's emphasis on AI integration via Vercel AI SDK. While the bio does not explicitly mention Next.js or experience with TypeScript, CSS, HTML, Git, or RESTful APIs, his front-end expertise likely covers some of these essentials, though this remains an assumption. His attention to detail and producing maintainable code fit well with the team's need for high-quality outputs and best practices. The candidate appears capable of collaborative work and problem-solving, important for cultural fit and teamwork. However, the lack of explicit mention of years of experience or junior level status makes it unclear if he perfectly matches the 1-2 year junior profile or if he is more senior, which may affect cultural fit. His familiarity with cutting-edge AI features suggests strong growth potential, especially in progressing with Next.js and React within an AI-driven context. Overall, Robert is a well-qualified candidate likely to contribute effectively and grow within this role."
8,Emily Davis,emilydavis@example.com,"Emily is a beginner developer with a passion for learning and growing within the web development space. She has been building her foundation in HTML, CSS, and JavaScript by working on personal projects and completing online tutorials. Emily is looking for an opportunity to work on real-world projects and contribute to a team while continuing to develop her technical skills.","HTML, CSS, JavaScript",45,"Emily Davis is a beginner developer passionate about learning web development basics such as HTML, CSS, and JavaScript, which aligns with some foundational technical requirements of the Junior React Developer role. However, she lacks the specific experience with React, Next.js, and the Vercel AI SDK required for this position. She has no demonstrated professional or project experience with React components, integrating AI features, or collaborating in a development team environment. Despite this, her enthusiasm for growth, willingness to contribute to a team, and desire to develop technical skills indicate strong growth potential and cultural fit for a supportive and mentorship-driven environment. Nonetheless, the current skill gap and lack of direct experience with key job technologies justify a moderate score, reflecting potential with significant learning needed to fully meet the job demands."
9,James Wilson,jameswilson@example.com,James is an intermediate developer with experience working primarily with React. He is eager to explore AI-driven projects and has recently started experimenting with Next.js and the Vercel AI SDK. James enjoys learning new technologies and applying them to solve real-world problems. He is looking for a role that will allow him to grow his skills and work on innovative projects.,"React, JavaScript, Next.js, Git",78,"James Wilson presents a solid fit for the Junior React Developer role. His background as an intermediate React developer aligns well with the job's need for 1-2 years of React and Next.js experience, and his recent experimentation with Next.js and the Vercel AI SDK matches the project’s focus on AI-driven features. While the bio does not explicitly mention proficiency in TypeScript, CSS, HTML, Git, or RESTful APIs, his eagerness to learn and explore new technologies suggests he can quickly grow these skills. Culturally, James’s enthusiasm for learning and passion for applying technology to solve real-world problems indicate a positive and growth-oriented mindset, fitting well with the collaborative and mentorship-driven environment described. His expressed desire for skill growth and innovative work aligns with the company's offer of mentorship and advanced technology exposure, highlighting strong growth potential. Overall, James is a promising candidate who meets the technical baseline and shows motivation and adaptability that could lead to excellent contribution and development within the company."
10,Amy White,amywhite@example.com,"Amy is a senior developer with extensive experience in full-stack development and AI integrations. She has led multiple projects, working with AI-powered tools such as CrewAI and the Vercel AI SDK to create dynamic, personalized web applications. Amy is passionate about mentoring junior developers and has a proven track record of delivering high-quality products.","React, Next.js, JavaScript, Vercel AI SDK, CrewAI, REST APIs, Git",68,"Amy White is a senior developer with extensive full-stack and AI integration experience, which exceeds the junior level required for this role. She has direct experience with AI-powered tools including the Vercel AI SDK, aligning well with the project's AI integration needs. However, the role specifically targets candidates with 1-2 years of front-end experience focused on React and Next.js, whereas Amy's seniority suggests a higher level of expertise and possibly less interest in a junior position. Her passion for mentoring junior developers and delivering high-quality products aligns well culturally, indicating strong teamwork and communication skills valued by the company. Growth potential is moderate since Amy is already advanced; this role may not fully challenge her or provide significant growth opportunities. Overall, while Amy's skills and experience surpass the job requirements and match well technically, her senior level may make her overqualified for this junior role, impacting cultural fit and growth potential in this specific context."
11,Jessica Brown,jessicabrown@example.com,Jessica is a motivated junior developer with a strong foundation in React and Next.js. She has recently completed an internship where she worked on a team to build a responsive web application for a local business. Jessica is eager to continue building her skills and gain more experience in AI technologies.,"React, Next.js, JavaScript, CSS",78,"Jessica possesses a foundational skill set closely aligned with the job requirements, specifically in React and Next.js, which are core technologies for this role. Her recent internship experience working on a responsive web application demonstrates practical exposure, although it is relatively limited in duration and scope compared to the desired 1-2 years of experience. While she does not currently have experience with the Vercel AI SDK, her eagerness to build skills in AI technologies indicates good growth potential and motivation to learn new tools relevant to this position. The job requires proficiency in JavaScript, TypeScript, CSS, HTML, and Git, which is implied but not explicitly confirmed in her bio, slightly lowering the score. Culturally, her motivation and desire for skill development fit well with the collaborative and mentorship-driven environment described. Overall, Jessica is a promising candidate for this junior role with the capability to grow into full job responsibilities under mentorship, making her a solid match but not yet fully seasoned."
12,Daniel Martinez,danielmartinez@example.com,Daniel is a front-end developer with several years of experience working with React. He has recently started integrating AI-driven features into his projects using the Vercel AI SDK and CrewAI. Daniel enjoys working on projects that challenge him to think outside the box and is always looking for ways to improve the user experience.,"React, Next.js, Vercel AI SDK, CrewAI, JavaScript, Git",83,"Daniel has relevant front-end development experience with React, which is a core requirement, and his recent work integrating AI-driven features using the Vercel AI SDK and CrewAI aligns well with the job's focus on AI integration. Although the bio does not explicitly mention Next.js experience, his use of React and AI SDK suggests a good foundational skill set to quickly learn Next.js. The job asks for 1-2 years experience, and while the bio states 'several years,' that likely meets or exceeds the experience threshold. There is no direct mention of proficiency with JavaScript, TypeScript, CSS, HTML, Git, or RESTful APIs, but his role as a front-end developer implies familiarity with these technologies. Cultural fit appears positive since Daniel enjoys challenging projects and improving user experience, which matches the company's innovative AI-driven goals. Additionally, his motivation to think outside the box indicates strong growth potential alongside the offered mentorship. Overall, Daniel is a strong candidate with a few minor unknowns (Next.js experience explicitly and some other technical stack details), warranting a high score but leaving room for verification and onboarding learning curve."
13,Olivia Clark,oliviaclark@example.com,"Olivia is a self-starter with a passion for web development. She has built several personal projects using React, focusing on improving her problem-solving skills. Olivia has a basic understanding of AI integrations and is eager to apply what she's learned in a professional setting.","React, JavaScript, CSS, HTML, Git",62,"Olivia demonstrates a clear passion and initiative in web development, particularly with React, which is central to the Junior React Developer role. However, her experience is primarily with personal projects, and she lacks the 1-2 years of professional front-end development experience with React and Next.js specified in the job description. Her basic understanding of AI integrations aligns with the role's focus on AI-driven features using Vercel AI SDK, but greater familiarity or hands-on experience would be preferred. Olivia's self-starter attitude and eagerness to apply learned skills in a professional environment indicate strong growth potential. Culturally, her proactive mindset fits well with a collaborative and mentorship-driven team, though she may need support initially to bridge gaps in technical depth and professional experience. Overall, she meets some key criteria but falls short in required experience and depth, resulting in a moderate score."
14,Matthew Evans,matthewevans@example.com,"Matthew is an experienced developer with expertise in full-stack development. He has worked on several AI-driven front-end applications, integrating advanced technologies such as the Vercel AI SDK and CrewAI. Matthew is passionate about creating user-friendly, high-performance web applications and enjoys tackling complex technical challenges.","React, Next.js, JavaScript, Vercel AI SDK, CrewAI, Git, REST APIs",82,"Matthew has strong relevant experience as a full-stack developer, including work on AI-driven front-end applications using technologies like the Vercel AI SDK, which aligns well with the job's focus on Next.js and AI integration. His expertise indicates proficiency in React and related technologies, though the bio does not explicitly mention experience with Next.js, TypeScript, Git, or RESTful APIs, which are key qualifications for this junior role. Matthew's passion for user-friendly and high-performance web applications reflects a good cultural fit, especially with a team focused on cutting-edge AI features. Given his background and enthusiasm for complex challenges, he shows solid growth potential and would benefit from mentorship. Overall, he is a strong candidate but may need to demonstrate more hands-on experience in some specific skills and junior-level responsibilities to fully meet the job requirements."
15,Sophia Baker,sophiabaker@example.com,Sophia is an entry-level developer who has recently started learning React and building personal projects. She is excited to continue growing her skills and has a particular interest in AI-powered web applications. Sophia is eager to learn from more experienced developers and contribute to a collaborative team.,"React, CSS, HTML, Git",62,"Sophia is an entry-level developer who has started learning React and building personal projects, showing a foundational skill set relevant to the Junior React Developer role. While she lacks the 1-2 years of professional experience required and does not explicitly mention proficiency in some key technical qualifications like TypeScript, CSS, HTML, Git, or RESTful APIs, her eagerness to learn and specific interest in AI-powered web applications align well with the job's focus on AI integration using the Vercel AI SDK. Her motivation to grow, work collaboratively, and learn from senior developers indicates a strong cultural fit and high growth potential. Given her current skill level and enthusiasm, she could be a solid candidate for the role but would likely need mentorship and time to reach full productivity."
16,Joshua Harris,joshuaharris@example.com,"Joshua is a mid-level developer specializing in React and Next.js. He has experience building scalable web applications for eCommerce platforms and is familiar with REST APIs. Joshua is always looking for new ways to improve his code and enjoys working in a fast-paced, dynamic environment.","React, Next.js, JavaScript, REST APIs, Git",82,"Joshua Harris aligns well with the Junior React Developer role as he possesses mid-level experience in React and Next.js, which slightly exceeds the 1-2 years specified but still fits the junior role requirements. His experience with scalable eCommerce web applications and REST APIs indicates a strong skill match and relevant working knowledge. While the job requires proficiency in JavaScript, TypeScript, CSS, and HTML, Joshua's bio mentions React and Next.js expertise but lacks explicit mention of TypeScript, CSS, and HTML proficiency; this may be an area for growth. There is no direct mention of experience with the Vercel AI SDK, which is a plus for the position, so this is a potential learning opportunity. Joshua's enthusiasm for improving his code and comfort with fast-paced dynamic environments reflects strong cultural fit and a good attitude for teamwork and continuous learning. Given the company's emphasis on mentorship and growth, Joshua shows promising potential to expand his AI integration skills and other required proficiencies. Overall, he is a solid candidate likely to succeed and grow in this role."
17,Chloe Turner,chloeturner@example.com,"Chloe is a developer passionate about AI-powered applications. She has strong skills in both CrewAI and the Vercel AI SDK, which she has used to create personalized, data-driven user experiences. Chloe is looking to work on cutting-edge projects where she can continue to grow her skills and contribute to innovative solutions.","React, Next.js, JavaScript, Vercel AI SDK, CrewAI, REST APIs, CSS",78,"Chloe Turner demonstrates a promising fit for the Junior React Developer role based on her strong passion for AI-powered applications and specific experience with the Vercel AI SDK, directly relevant to the job's AI integration focus. She has practical skills with CrewAI and the Vercel AI SDK, indicating familiarity with advanced AI technologies, which is a key advantage. However, the bio does not explicitly mention her experience with React, Next.js, or foundational front-end technologies like JavaScript, TypeScript, CSS, or HTML, nor does it specify her years of development experience, which are core qualifications for the role. Despite this, her eagerness to work on cutting-edge projects and grow her skills aligns well with the company's supportive culture and the junior level nature of the position. Her growth potential appears strong given her enthusiasm for innovation and learning. Overall, Chloe is a compelling candidate for someone at a junior level with a focus on AI integration but would benefit from clearer evidence of hands-on experience with React and Next.js to fully meet the technical requirements."
