id,name,email,bio,skills,score,reason
18,Luke Roberts,lukeroberts@example.com,"Luke is a junior developer focused on building user-friendly React applications with clean, efficient code. He has a strong understanding of front-end fundamentals and is eager to continue building his skills in more advanced technologies, such as Next.js and AI integrations.","React, JavaScript, CSS, HTML",72,"Luke Roberts demonstrates a solid foundational skill set as a junior developer with a focus on React applications and clean coding practices, aligning well with the Junior React Developer role. His eagerness to develop skills in Next.js and AI integrations is a positive indicator of growth potential and motivation to adapt to the specific technologies the job requires. However, his current experience appears limited to React without explicit mention of Next.js or proficiency in TypeScript, CSS, HTML, Git, or RESTful APIs, which are key qualifications for this role. The lack of familiarity with Vercel AI SDK is noted but understandable given his junior status; nevertheless, willingness to learn can mitigate this gap. Culturally, his eagerness to learn and improve fits the collaborative and growth-oriented environment described in the job. Overall, Luke is a promising candidate with a moderate skill match and high growth potential, suitable for a supportive and mentorship-driven role but requiring some ramp-up time to meet all technical expectations fully."
19,Emma Mitchell,emmamitchell@example.com,Emma is a web developer with strong skills in integrating AI solutions into front-end projects. She has experience working with both the Vercel AI SDK and CrewAI and enjoys creating applications that provide a seamless user experience. Emma is looking to join a team where she can contribute her technical skills and continue to grow as a developer.,"React, Next.js, JavaScript, Vercel AI SDK, CrewAI, REST APIs",83,"Emma Mitchell demonstrates a strong alignment with the Junior React Developer role, particularly with her skills in integrating AI solutions into front-end projects and specific experience with the Vercel AI SDK, which is a key requirement of the job. While the bio does not explicitly mention her proficiency in React, Next.js, JavaScript, TypeScript, or other front-end technologies (CSS, HTML) listed in the job description, her role as a web developer integrating AI on front-end projects suggests relevant experience. Emma's enthusiasm for contributing technical skills and desire to grow matches well with the company's offering of mentorship and growth potential. She appears suitable culturally, as she values collaboration and growth which aligns with the job's emphasis on teamwork and learning. However, the lack of explicit mention of 1-2 years of front-end experience and specific technologies slightly lowers the confidence in a perfect fit. Overall, Emma is a strong candidate with solid potential and relevant AI integration skills, meriting a high score but not perfect due to some unspecified experience details."
20,Henry Garcia,henrygarcia@example.com,"Henry is a recent graduate with a focus on AI-powered web applications. He has completed several projects, including a Next.js app that leverages the Vercel AI SDK for personalized recommendations. Henry is passionate about applying AI to solve real-world problems and is eager to join a team that shares his enthusiasm.","React, JavaScript, Vercel AI SDK, CrewAI, Next.js, Git",70,"Henry Garcia shows a promising fit for the Junior React Developer role due to his focused academic background on AI-powered web applications and hands-on projects with Next.js and the Vercel AI SDK, which aligns well with the job's technical requirements. However, as a recent graduate, he lacks the preferred 1-2 years of professional front-end development experience, which may impact his immediate productivity on complex tasks. His passion for applying AI to real-world problems and eagerness to join a collaborative team indicate a good cultural fit and high growth potential, especially with provided mentorship. While he may require some initial guidance, his skills and enthusiasm make him a strong candidate for developing further expertise in React, Next.js, and AI integration within the company."
21,Grace Hill,gracehill@example.com,"Grace is a junior developer with a strong foundation in web development and a growing interest in AI technologies. She has built multiple personal projects using React and JavaScript, including a weather app and a blog site. Grace is eager to join a team where she can expand her knowledge of Next.js and AI-driven solutions.","React, JavaScript, CSS, HTML, Git",72,"Grace Hill exhibits a strong foundation in web development with practical experience in React and JavaScript, demonstrated through personal projects like a weather app and a blog site. While she is a junior developer and currently lacks formal professional experience explicitly with Next.js and AI-driven solutions, her eagerness to grow in these areas aligns well with the job's growth and learning opportunities. She meets the key skill requirements related to React and JavaScript, though she does not mention experience with TypeScript, CSS, HTML, or version control systems like Git, which are also important for this role. Additionally, familiarity with the Vercel AI SDK is a plus, which Grace does not currently have but could develop given her interest in AI technologies. Culturally, her enthusiasm for joining a team to expand her knowledge suggests good potential for teamwork and learning under mentorship as offered. Overall, Grace presents a promising candidate with a solid skill base and a clear desire to develop the necessary competencies, making her a good fit for a junior role focused on growth and collaboration."
22,David Foster,davidfoster@example.com,David is a mid-level React developer with experience in building responsive web applications using Next.js. He has worked on several eCommerce projects and is proficient in modern front-end technologies. David has recently started exploring AI integrations using the Vercel AI SDK and is looking for a role where he can apply these skills.,"React, Next.js, JavaScript, CSS, HTML, Git",85,"David Foster aligns well with the Junior React Developer role, possessing the core technical skills required, including experience with React, Next.js, and modern front-end technologies which match the job's technical needs. His work on responsive eCommerce projects demonstrates relevant practical experience and understanding of application performance and user experience. Moreover, David's recent exploration of AI integrations with the Vercel AI SDK reflects his initiative to grow in the key area emphasized by the job. Although he is slightly more experienced than a typical junior developer (mid-level), this can be seen as an advantage as he can contribute effectively while still benefiting from mentorship, fitting well culturally with a collaborative and growth-focused environment. His motivation to apply and develop AI-related skills aligns strongly with the cutting-edge technology focus of the company. The score reflects a slightly above-average match with potential for growth and valuable contribution, though the role might normally target candidates with slightly less experience."
23,Isabella Russell,isabellarussell@example.com,Isabella is an entry-level developer with basic React knowledge and a passion for learning new technologies. She has completed several online courses and built personal projects focused on improving her front-end development skills. Isabella is looking for an opportunity to gain hands-on experience and contribute to a real-world project.,"React, CSS, HTML, JavaScript",62,"Isabella Russell is an entry-level developer with basic React knowledge and a strong passion for learning, which aligns well with the Junior React Developer role focused on React and Next.js development. However, she lacks the 1-2 years of professional experience required and no explicit mention of Next.js, TypeScript, or experience with Git, RESTful APIs, or AI-related technologies like the Vercel AI SDK is provided. Her completion of online courses and personal projects demonstrates motivation and foundational skills, indicating good growth potential. The cultural fit seems positive given her eagerness to contribute and learn in a collaborative environment. Overall, while her current skill set may require mentorship and substantial development, she has potential to grow into the role given the learning-focused nature of the position."
24,Ethan Reed,ethanreed@example.com,"Ethan is a self-taught web developer with experience in full-stack development and AI-driven solutions. He has built several web applications using React, Next.js, and the Vercel AI SDK. Ethan enjoys tackling complex problems and is excited to continue working on AI-powered projects that enhance user experience.","React, Next.js, JavaScript, CrewAI, Vercel AI SDK, REST APIs",82,"Ethan Reed demonstrates a strong alignment with the Junior React Developer role. He has hands-on experience with React, Next.js, and the Vercel AI SDK, which are core technologies listed in the job description. Being self-taught and having built multiple web applications reflects initiative, a key cultural fit for a company valuing independent work and growth potential. Although specific mention of proficiency in JavaScript, TypeScript, CSS, HTML, Git, and RESTful APIs is absent, his experience as a full-stack developer implies familiarity with these essential skills. The enthusiasm for AI-driven projects matches well with the job’s focus on AI integration, indicating a strong motivation and potential to excel. While his experience duration is not explicitly stated, the profile suggests capability at a junior level. Overall, Ethan appears well-equipped to contribute effectively, collaborate with senior developers, and grow within the role, earning a solid score reflecting a promising but slightly unverified depth in some technical areas."
25,Abigail Ward,abigailward@example.com,Abigail is an intermediate developer with strong React skills and experience in integrating AI into web applications. She has worked on projects that leverage the Vercel AI SDK to deliver personalized content to users. Abigail is passionate about user experience and enjoys building applications that are both functional and visually appealing.,"React, Next.js, JavaScript, Vercel AI SDK, CSS, Git",83,"Abigail Ward is a strong fit for the Junior React Developer role due to her intermediate React skills and experience integrating AI via the Vercel AI SDK, which directly aligns with the job's key responsibilities. Her focus on user experience and building both functional and visually appealing applications matches the role's emphasis on performance and responsiveness. Although her experience level is described as intermediate rather than explicitly 1-2 years, it is implied she has relevant hands-on experience with React and AI integrations, which is a significant asset. There is no explicit mention of knowledge in Next.js, TypeScript, CSS, HTML, Git, or RESTful APIs, which are important qualifications and impact the score negatively. However, her passion for user experience and building applications indicates strong motivation and potential for growth, fitting culturally with a collaborative and innovative environment. Overall, she demonstrates solid relevant skills and promising growth potential but lacks explicit coverage of all listed technologies and tools required, resulting in a score in the low 80s."
26,Aiden Bailey,aidenbailey@example.com,Aiden is an experienced full-stack developer with a focus on front-end technologies and AI-powered tools. He has led several projects that use CrewAI and the Vercel AI SDK to provide advanced AI-driven features. Aiden is excited to join a team where he can continue building innovative solutions and mentor junior developers.,"React, Next.js, JavaScript, CrewAI, Vercel AI SDK, REST APIs",78,"Aiden Bailey shows strong alignment with the job requirements as an experienced full-stack developer with a focus on front-end technologies, especially involving AI-powered tools. His experience leading projects using CrewAI and the Vercel AI SDK is highly relevant since the job involves integrating AI-driven features using the Vercel AI SDK. While Aiden appears to have advanced experience beyond the junior level sought, which could be a positive for growth and mentorship potential, the job specifically targets candidates with 1-2 years of experience, implying a more junior level. He expresses enthusiasm for mentoring junior developers, which may indicate cultural fit in a supportive team environment, though he may need to adjust expectations about junior-level role responsibilities. The candidate's skills do not explicitly mention React, Next.js, JavaScript, TypeScript, or CSS which are core technical requirements, though his full-stack front-end background suggests probable familiarity. Overall, Aiden’s advanced experience and AI integration skills make him a strong fit, possibly exceeding the junior role but capable of bringing valuable mentorship and innovation to the team."
27,Lily King,lilyking@example.com,"Lily is a junior developer with a solid understanding of React. She has worked on a few personal projects, including a to-do list app and a portfolio website. Lily is eager to contribute to AI-driven projects and is currently learning Next.js to improve her front-end development skills.","React, JavaScript, CSS, HTML, Git",68,"Lily King is a junior developer with a solid understanding of React, which aligns well with the core requirement of the Junior React Developer role. Her experience is primarily from personal projects, indicating practical exposure but limited professional experience. She is eager to work on AI-driven projects and is currently learning Next.js, which is important since the role heavily involves Next.js development. However, she does not yet meet the preferred experience threshold of 1-2 years nor demonstrate proficiency in related technologies such as TypeScript, CSS, HTML, Git, and RESTful APIs, which are crucial for this position. Additionally, familiarity with the Vercel AI SDK is a plus she has not yet attained. Culturally, her eagerness to learn and contribute suggest a good fit for a collaborative and mentorship-focused environment. Overall, Lily shows strong growth potential and foundational skill alignment but lacks the full range of technical experience and professional background necessary for a higher score."
28,Benjamin Turner,benjaminturner@example.com,Benjamin is a front-end developer with experience in modern web technologies and AI integrations. He has contributed to several projects that use the Vercel AI SDK and CrewAI to provide personalized user experiences. Benjamin is passionate about building scalable web applications and improving his skills in AI-powered solutions.,"React, Next.js, Vercel AI SDK, CrewAI, JavaScript, CSS",85,"Benjamin Turner shows a strong alignment with the Junior React Developer role. His experience as a front-end developer with modern web technologies and AI integrations particularly matches the job's focus on Next.js and Vercel AI SDK usage. Contributions to projects involving Vercel AI SDK and CrewAI demonstrate relevant hands-on experience with AI-powered features, a key component of the job. While the bio does not explicitly mention proficiency in React, Next.js, or related core front-end technologies like JavaScript, TypeScript, CSS, HTML, and Git, his involvement in scalable web applications suggests familiarity with these foundational skills. The passion for improving AI-powered solutions underscores good growth potential and a motivated mindset, which fits well with the junior development role that offers mentorship and career development. Cultural fit appears positive due to his enthusiasm and collaboration implied through project contributions. Overall, the candidate is well-suited with minor unknowns regarding explicit technical skill coverage, but strong in relevant experience and growth potential."
29,Zoe Barnes,zoebarnes@example.com,Zoe is a junior developer looking to grow her skills in React and AI-driven web applications. She has built several personal projects and is constantly learning new technologies to improve her code. Zoe is excited to work on real-world projects where she can continue developing her skills and gain experience in AI integrations.,"React, CSS, HTML, JavaScript, Git",72,"Zoe Barnes demonstrates a clear enthusiasm for growing her skills in React and AI-driven web applications, aligning well with the job's focus on React, Next.js, and AI integration using the Vercel AI SDK. Although the bio mentions only personal projects and continuous learning, it lacks explicit reference to professional experience or specific proficiency in key technologies such as JavaScript, TypeScript, CSS, HTML, Git, or RESTful APIs. This places her likely at an early career stage, which is consistent with a junior developer profile. Her motivation to work on real-world projects and eagerness to develop new skills reflect high growth potential and a good cultural fit for a collaborative, mentorship-driven environment. However, the absence of stated hands-on experience with AI SDKs or professional development in relevant frameworks suggests she may require additional training and supervision initially. Overall, Zoe appears to be a promising candidate who fits the junior level and growth orientation the role envisages, but she currently falls short on demonstrable relevant technical experience which tempers the score."
30,Alexander Cook,alexandercook@example.com,Alexander is an experienced developer specializing in building high-performance web applications using React and Next.js. He has worked on projects that leverage CrewAI and the Vercel AI SDK to enhance user engagement through personalized features. Alexander enjoys working in fast-paced environments and collaborating with teams to build innovative solutions.,"React, Next.js, JavaScript, CrewAI, Vercel AI SDK, REST APIs",89,"Alexander Cook is a strong fit for the Junior React Developer role. His experience specializing in React and Next.js directly matches the job's primary technical requirements. He has practical exposure to the Vercel AI SDK and CrewAI, which aligns well with the job's focus on AI-driven features integration. His enjoyment of fast-paced environments and teamwork indicates good cultural fit for a collaborative and innovative workplace. Although specifics like years of experience, proficiency in TypeScript, CSS, HTML, Git, and RESTful APIs aren't explicitly detailed, his demonstrated skills suggest he likely meets or exceeds these baseline qualifications. Additionally, his willingness to collaborate and innovate reflects solid growth potential under mentorship. Overall, Alexander is poised to contribute effectively and grow within the role, justifying a high score slightly below perfect to allow for some unknowns in detail."
